{"schema_version":"2.0.0","election_year":2015,"election_type":"midterm","unit":"rule_candidate","source_id":"ine_counted_lists","rate_unit":"proportion","data":[{"election_year":2015,"profile_id":"adult_favorable","status":"supported","age_band":"35-59","segments":2955,"municipalities":1591,"states":31,"LN":16001024,"SV":9322543,"NV":5645561,"NS":1032920,"source_row_count":1520488,"sex_2_source_rows":0,"sex_2_nominal_count":0,"specified_count":14968104,"participation_observed":0.6228272465236746,"matched_peer_reference":0.5213400067386779,"participation_delta":0.10148723978499674,"mean_segment_delta":0.16355142539683812,"delta_q1":0.06986701040485821,"delta_median":0.14820055064576942,"delta_q3":0.24152739890868696,"delta_min":6.840952309550286e-05,"delta_max":0.4967308299052611,"near_reference_segments":231,"near_reference_fraction":0.07817258883248732,"high_ns_segments":532,"high_ns_fraction":0.18003384094754654,"unspecified_rate":0.0645533685844106,"nominal_coverage":0.19148349789528826,"core_nominal_coverage":0.1915117903211276,"women_segment_fraction":0.5093062605752962,"women_nominal_fraction":0.5503650891342954,"specified_min":100,"specified_median":1852.0,"source_rows_median":248.0,"sections_median":10.0,"sections_min":1,"low_section_segments":763,"distinct_sections":null,"nominal_share_U":0.5925835121552221,"nominal_share_R":0.25172251475905544,"nominal_share_M":0.15569397308572253,"label":"35-59 años · por encima de sus pares"},{"election_year":2015,"profile_id":"adult_unfavorable","status":"supported","age_band":"35-59","segments":1750,"municipalities":989,"states":27,"LN":20051284,"SV":8250709,"NV":10646350,"NS":1154225,"source_row_count":1787092,"sex_2_source_rows":0,"sex_2_nominal_count":0,"specified_count":18897059,"participation_observed":0.4366133904752057,"matched_peer_reference":0.5170156129737379,"participation_delta":-0.08040222249853218,"mean_segment_delta":-0.09307691736721953,"delta_q1":-0.1330623553809776,"delta_median":-0.0771592499602286,"delta_q3":-0.03773995360018423,"delta_min":-0.37261905884774965,"delta_max":-0.00028230012438734686,"near_reference_segments":221,"near_reference_fraction":0.12628571428571428,"high_ns_segments":224,"high_ns_fraction":0.128,"unspecified_rate":0.0575636453007199,"nominal_coverage":0.2399527678735953,"core_nominal_coverage":0.23998822182113974,"women_segment_fraction":0.48914285714285716,"women_nominal_fraction":0.5016364039330349,"specified_min":100,"specified_median":1996.0,"source_rows_median":225.0,"sections_median":9.0,"sections_min":1,"low_section_segments":558,"distinct_sections":null,"nominal_share_U":0.8071947911166187,"nominal_share_R":0.09738688056086582,"nominal_share_M":0.0954183283225154,"label":"35-59 años · por debajo de sus pares"},{"election_year":2015,"profile_id":"older_favorable","status":"supported","age_band":"60-100","segments":2387,"municipalities":1323,"states":31,"LN":6763968,"SV":4150566,"NV":2231127,"NS":382275,"source_row_count":1722207,"sex_2_source_rows":0,"sex_2_nominal_count":0,"specified_count":6381693,"participation_observed":0.650386347321941,"matched_peer_reference":0.5820750790966602,"participation_delta":0.06831126822528077,"mean_segment_delta":0.11278553457735538,"delta_q1":0.04363268561293565,"delta_median":0.09546859898731053,"delta_q3":0.1633081619473683,"delta_min":0.00010940636306089324,"delta_max":0.3867458575542888,"near_reference_segments":279,"near_reference_fraction":0.11688311688311688,"high_ns_segments":441,"high_ns_fraction":0.18475073313782991,"unspecified_rate":0.056516382099974456,"nominal_coverage":0.08094408534677512,"core_nominal_coverage":0.08095604514778659,"women_segment_fraction":0.48554671135316296,"women_nominal_fraction":0.5429919242669392,"specified_min":100,"specified_median":921.0,"source_rows_median":292.0,"sections_median":11.0,"sections_min":1,"low_section_segments":543,"distinct_sections":null,"nominal_share_U":0.6765407524104194,"nominal_share_R":0.21203766783048056,"nominal_share_M":0.11142157975909998,"label":"60-100 años · por encima de sus pares"},{"election_year":2015,"profile_id":"older_unfavorable","status":"supported","age_band":"60-100","segments":2168,"municipalities":1222,"states":29,"LN":6344358,"SV":3048688,"NV":2933401,"NS":362269,"source_row_count":1764975,"sex_2_source_rows":0,"sex_2_nominal_count":0,"specified_count":5982089,"participation_observed":0.5096360151111092,"matched_peer_reference":0.5824073831568884,"participation_delta":-0.07277136804577922,"mean_segment_delta":-0.09922920387172862,"delta_q1":-0.14186115939628613,"delta_median":-0.08346633741182666,"delta_q3":-0.039133831887606635,"delta_min":-0.47503580386667466,"delta_max":-8.787947362809412e-06,"near_reference_segments":299,"near_reference_fraction":0.1379151291512915,"high_ns_segments":278,"high_ns_fraction":0.1282287822878229,"unspecified_rate":0.057100970657708784,"nominal_coverage":0.07592263231027935,"core_nominal_coverage":0.07593385017222451,"women_segment_fraction":0.5239852398523985,"women_nominal_fraction":0.5302257533386356,"specified_min":100,"specified_median":857.5,"source_rows_median":265.0,"sections_median":10.0,"sections_min":1,"low_section_segments":629,"distinct_sections":null,"nominal_share_U":0.6925428861359968,"nominal_share_R":0.191227859461903,"nominal_share_M":0.11622925440210026,"label":"60-100 años · por debajo de sus pares"},{"election_year":2015,"profile_id":"young_favorable","status":"supported","age_band":"18-34","segments":2755,"municipalities":1488,"states":31,"LN":14412365,"SV":6577996,"NV":6875792,"NS":958577,"source_row_count":971150,"sex_2_source_rows":0,"sex_2_nominal_count":0,"specified_count":13453788,"participation_observed":0.4889326336939455,"matched_peer_reference":0.3777427031746467,"participation_delta":0.11118993051929882,"mean_segment_delta":0.18209787467520858,"delta_q1":0.06564340645974415,"delta_median":0.15332427352144107,"delta_q3":0.27089198734917624,"delta_min":5.496715640873617e-06,"delta_max":0.6082270046400777,"near_reference_segments":226,"near_reference_fraction":0.08203266787658803,"high_ns_segments":492,"high_ns_fraction":0.17858439201451906,"unspecified_rate":0.06651073574670084,"nominal_coverage":0.17247209073266975,"core_nominal_coverage":0.1724975741497268,"women_segment_fraction":0.520508166969147,"women_nominal_fraction":0.5140752402537682,"specified_min":100,"specified_median":1955.0,"source_rows_median":178.0,"sections_median":11.0,"sections_min":1,"low_section_segments":621,"distinct_sections":null,"nominal_share_U":0.547953510752746,"nominal_share_R":0.2860735902816783,"nominal_share_M":0.16597289896557574,"label":"18-34 años · por encima de sus pares"},{"election_year":2015,"profile_id":"young_unfavorable","status":"supported","age_band":"18-34","segments":1919,"municipalities":1072,"states":27,"LN":19856709,"SV":5554647,"NV":13154930,"NS":1147132,"source_row_count":1300370,"sex_2_source_rows":0,"sex_2_nominal_count":0,"specified_count":18709577,"participation_observed":0.2968878986414284,"matched_peer_reference":0.3768356115235287,"participation_delta":-0.07994771288210029,"mean_segment_delta":-0.08709019076859088,"delta_q1":-0.1236093613426297,"delta_median":-0.07438896310048154,"delta_q3":-0.037856415821576506,"delta_min":-0.3229365761340759,"delta_max":-0.00022973171300005868,"near_reference_segments":240,"near_reference_fraction":0.12506513809275666,"high_ns_segments":250,"high_ns_fraction":0.13027618551328818,"unspecified_rate":0.05777049963314666,"nominal_coverage":0.2376242980454783,"core_nominal_coverage":0.237659407952619,"women_segment_fraction":0.4731631057842626,"women_nominal_fraction":0.5018179497921836,"specified_min":100,"specified_median":1831.0,"source_rows_median":136.0,"sections_median":9.0,"sections_min":1,"low_section_segments":670,"distinct_sections":null,"nominal_share_U":0.7828484569119687,"nominal_share_R":0.11129150354169969,"nominal_share_M":0.10586003954633168,"label":"18-34 años · por debajo de sus pares"}],"warnings":["Son segmentos agregados, no personas ni clases naturales descubiertas.","NS representa no especificación, no abstención. Las tasas no definidas son NULL.","Las claves territoriales se consultan dentro de cada elección; no hay equivalencias municipales históricas oficiales validadas.","U/R/M describe secciones electorales, no residencia individual ni localidad.","La lista nominal reportada procede de cuadernillos; no incluye casillas especiales ni voto del extranjero según el diccionario.","Los municipios pueden pertenecer a varios perfiles; su cobertura no se suma entre perfiles.","Los intervalos y el signo relativo son reglas explícitas. Una diferencia cercana a cero requiere cautela."]}